<thepipeline xmlns="https://thepipeline.com" xsi:schemaLocation="https://thepipeline.com ../xsd/thepipeline.xsd" xmlns:xsi="http://www.w3.org/2001/XMLSchema-instance">
    <tool id="vbcc6502" type="cli" target="6502">
        <command host="linux" wrapper="wine" file="/home/ttrocha/_dev/projects/retro/CrossEngine/Compiler/6502/vbcc6502/vbcc6502_win/vbcc/bin/vbcc6502.exe"/>
    </tool>

    <tool id="gcc" type="cli" target="linux">
        <command host="linux" file="/usr/bin/gcc"/>
    </tool>
    
    <converter prefix="compile" name="gcc" target="linux">
        <parameters>
            <param id="in" output="@" type="multifile" />
            <param id="out" expose="true" output="-o @" type="file"/>            
        </parameters>
        <command arguments="@@" toolid="gcc" />
    </converter>
</thepipeline> 