<thepipeline  xmlns="https://thepipeline.com" xsi:schemaLocation="https://thepipeline.com ../xsd/thepipeline.xsd" xmlns:xsi="http://www.w3.org/2001/XMLSchema-instance">
    
    <tool id="convert" type="cli">
        <command host="linux" file="/usr/bin/convert"/>
    </tool>
    <tool id="montage" type="cli">
        <command host="linux" file="/usr/bin/montage"/>
    </tool>
    
    <converter prefix="ic" name="indexed"> 
        <parameters>
            <param id="in" output="@" type="file"/>
            <param id="out" output="@" type="file"/>
            <param id="colors" output="-colors @" type="number[0-255]" required="true" description="amount of colors" />
            <param id="dither" output="+dither" type="bool" description="dither result"/>
        </parameters> 
        <command toolid="convert" arguments="@[in] @@ @[out]" extension="png"/>
    </converter>

    <converter prefix="ic" name="rotate"> 
        <parameters>
            <param id="in" output="@" type="file"/>
            <param id="out" output="@" type="file"/>
            <param id="background" output="-background ''@'' -virtual-pixel ''background'' " type="enum[transparent,#rgb,#rrggbb,#rrggbbaa]"/>
            <param id="degree-keepsize" output="-distort SRT @" type="number[0-360]" description="rotate image degrees" />
            <param id="degree" output="-rotate @" type="number[0-360]" description="rotate image degrees" />
        </parameters> 
        <command toolid="convert" arguments="@[in] @@ @[out]" extension="png"/>
    </converter>

    <converter name="rescale" prefix="ic">
        <parameters>
            <param id="in" output="@" type="file"/>
            <param id="out" output="@" type="file"/>
            <param id="scale-xy" output="-resize @[0]x@[1]" type="vec[2]" />
            <param id="forcescale-xy" output="-resize @[0]x@[1]!" type="vec[2]" />
            <param id="scale-percent" output="-resize @%" type="number[0-100]" />
            <param id="forcescale-percent" output="-resize @%" type="number[0-100]" />
        </parameters>
        <command arguments="@[in] @@ @[out]" toolid="convert" />
    </converter>

    <converter prefix="ic" name="im-spritepacker">
        <parameters>
            <param id="in" output="@" type="multifile"/>
            <param id="out" output="@" type="file"/>
            <param id="tile" output="-tile @[0]x@[1]" type="vec[2]" />
            <param id="size" output="-geometry @[0]x@[1]+0+0" type="vec[2]"/>
        </parameters>
        <command arguments="@[in] @@ -background transparent @[out]" toolid="montage" extension="png"/>
    </converter>
</thepipeline>