<thepipeline xmlns="https://thepipeline.com" xsi:schemaLocation="https://thepipeline.com ../xsd/thepipeline.xsd" xmlns:xsi="http://www.w3.org/2001/XMLSchema-instance">
    <tool id="rg-tiled-conversion" type="cli">
        <command host="linux" file="@/../../tools/linux/rg/TilEdConverter" />
    </tool>

    <converter name="convert-tiled-map" prefix="rg">
        <parameters>
            <param id="in" output="@"  type="file" />
            <param id="compression" output="-compress" type="bool"/>
            <param id="out" output="@" type="file"/>            
        </parameters>
        <command arguments="@[in] @@" toolid="rg-tiled-conversion" extension="map"/>
    </converter>

    <converter name="convert-tiled-tileset" prefix="rg">
        <parameters>
            <param id="in" output="@"  type="file"/>
            <param id="out" output="@" type="file"/>            
        </parameters>
        <command arguments="@[in] -tileset @[out]" toolid="rg-tiled-conversion" extension="ts"/>
    </converter>


</thepipeline> 
