<thepipeline xmlns="https://thepipeline.com" xsi:schemaLocation="https://thepipeline.com ../xsd/thepipeline.xsd" xmlns:xsi="http://www.w3.org/2001/XMLSchema-instance">
    <tool id="GFXConv" type="cli">
        <command host="linux" file="@/../../tools/linux/rg/GFXConvert"/>
    </tool>

    <!-- $(PIPECMD) /opt/tools/wine.sh /opt/tools/win_host/IrfanView/i_view64.exe $(WINE_ASSETS)\\palette\\AMIGA.bmp /export_pal=$(WINE_ASSETS)\\palette\\AMIGA.pal  /killmesoftly -->
    <converter name="convert-sprites" prefix="rg">
        <parameters>
            <param id="in" output="@" type="file" />
            <param id="out" output="@" type="file" />
            <param id="palette" output="@" type="file" />
        </parameters>
        <command arguments="sprite @[target] @[in] @[out] @[palette]" toolid="GFXConv" extension="bin"/>
    </converter>

    <converter name="convert-tileset" prefix="rg">
        <parameters>
            <param id="in" output="@" type="file" />
            <param id="out" output="@" type="file" />
            <param id="palette" output="@" type="file"  />

        </parameters>
        <command arguments="tileset @[target] @[in] @[out] @[palette]" toolid="GFXConv" extension="bin"/>
    </converter>

</thepipeline> 