<?xml version="1.0"?>
<thepipeline  xmlns="https://thepipeline.com" xsi:schemaLocation="https://thepipeline.com ../xsd/thepipeline.xsd" xmlns:xsi="http://www.w3.org/2001/XMLSchema-instance">
    <converter prefix="ic" name="psx-tim" target="psx">
        <parameters>
            <param id="in" output="@" type="file"/>
            <param id="out" output="-o @" type="file"/>
            <param id="vpos" output="-org @[0] @[1]" type="vec[2]" description="Position of the texture in psx-vram"/>
            <param id="cpos" output="-plt @[0] @[1]" type="vec[2]" description="Position of the CLUT in the vram"/>
            <param id="bpp" output="-bpp @" type="strict-enum[4,8,16,24]" description="bits per color-information"/>
            <param id="alpha" output="-usealpha" type="bool" description="Use alpha"/> 
        </parameters>  
        <command toolid="img2tim" arguments="@@" extension="tim"/>
    </converter>

    <!-- ffmpeg -y -i raw/music/horn.wav -f s16le -ac 1 -ar 44100 tmp.dat -->
    <converter prefix="ac" name="psx-wav-format" target="psx">
        <parameters>
            <param id="in" output="@" type="file"/>
            <param id="out" output="@" type="file"/>
        </parameters>
        <command arguments="-y -i @[in] -f s16le -ac 1 -ar 44100 @[out]" toolid="ffmpeg" extension="wav"/>
    </converter>

    <!-- wav2vag tmp.dat vag/horn.vag -sraw16 -freq 44100 -->
    <converter prefix="ac" name="psx-vag-format">
        <parameters>
            <param id="in" output="@" type="file"/>
            <param id="out" output="@" type="file"/>
        </parameters>
        <command arguments="@[in] @[out] -sraw16 -freq 44100" toolid="wav2vag" extension="vag"/>
    </converter>
</thepipeline>